Title,Column,Labels,Assignees,Initiative,Milestone
Present to IITB DGComm,Done Enough,initiative:product,remyb2canada,initiative:product,Product Mgt - Create Branch Inititaive
Present BI to PPOC,Done Enough,initiative:product,remyb2canada,initiative:product,Product Mgt - Create Branch Inititaive
"James and Leigh added ",Done Enough,website,ElminaIusifova,,
Add Leigh and James to IT Strategy website,Done Enough,website,ElminaIusifova,,
MA - Present at the DECD weekly show and tell?,Done Enough,initiative:micro-acquisitions,RachelMuston,initiative:micro-acquisitions,Micro-acquisition pilot: Fall launch
Decide whether to restrict eligibility to under-represented groups and/or freelancers and small businesses,Done Enough,initiative:micro-acquisitions,,initiative:micro-acquisitions,Micro-acquisitions pilot: Operations and Continuous Improvement
Finalize minimum code Acceptance Criteria for all Micro-Acquisitions,Done Enough,initiative:micro-acquisitions,RachelMuston,initiative:micro-acquisitions,Micro-acquisitions pilot: Operations and Continuous Improvement
MA - think through division of workload,Done Enough,initiative:micro-acquisitions,"RachelMuston, philipe-girard",initiative:micro-acquisitions,Micro-acquisitions pilot: Operations and Continuous Improvement
Plan for and hold launch event,Done Enough,"communications, initiative:micro-acquisitions",,initiative:micro-acquisitions,Micro-acquisition pilot: Fall launch
Create Risk Register,Done Enough,initiative:product,remyb2canada,initiative:product,Product Mgt - Create Branch Inititaive
Address EA assessment,Done Enough,initiative:product,remyb2canada,initiative:product,Product Mgt - Create Branch Inititaive
Renew Luc Vienneau Casual Contract,Done Enough,initiative:hr-process,philipe-girard,initiative:hr-process,IM/IT Strategy and Planning HR Process
Mid-Year Reviews,Done Enough,,philipe-girard,,Team's own Continuous Improvement and Administration
TAC Presentation,Done Enough,initiative:product,remyb2canada,initiative:product,Product Mgt - Do Peer Reviews
modified english version of product-management strategy,Done Enough,initiative:product,,initiative:product,Product Mgt - Produce Framework
Transition to Product Management intake criteria (EPMO),Done Enough,initiative:product,remyb2canada,initiative:product,Product Mgt - Produce Framework
SAP blueprint of product management,Done Enough,initiative:product,remyb2canada,initiative:product,Product Mgt - Do Research
2 Pager - Amazon Style,Done Enough,strategies,,,Z [Pending] Open First Strategy
MA - Review Translation of IITB Showcase presentation,Done Enough,initiative:micro-acquisitions,"RachelMuston, remyb2canada",initiative:micro-acquisitions,Micro-acquisitions pilot: 3 - Communications
Test new consultation column,Done Enough,,"gcharest, LeighGardner",,Team's own Continuous Improvement and Administration
Blog - Product Management Part 2,Done Enough,"Blog, initiative:product",remyb2canada,initiative:product,Product Mgt - Do Peer Reviews
Fix number of sections,Done Enough,,,,Z [Pending] Open First Strategy
Exploration - Map Product Management framework elements with existing PM/Portfolio methods,Done Enough,initiative:product,remyb2canada,initiative:product,Product Mgt - Produce Framework
User Engagement in Service Delivery blog,Done Enough,Blog,ElminaIusifova,,
Restructure strategy,Done Enough,strategies,gcharest,,Z [Pending] Open First Strategy
Setup consultation tracker,Done Enough,strategies,gcharest,,Z [Pending] Open First Strategy
Produce Branch Initiative Charter/Plan,Done Enough,initiative:product,remyb2canada,initiative:product,Product Mgt - Create Branch Inititaive
MA - prepare presentation for IITB influencers network,Done Enough,initiative:micro-acquisitions,RachelMuston,initiative:micro-acquisitions,Micro-acquisition pilot: Fall launch
MA - schedule presentation at IITB Influencers network,Done Enough,initiative:micro-acquisitions,RachelMuston,initiative:micro-acquisitions,Micro-acquisition pilot: Fall launch
MA - IITB newsletter item,Done Enough,initiative:micro-acquisitions,"RachelMuston, remyb2canada",initiative:micro-acquisitions,Micro-acquisition pilot: Fall launch
MA - Prepare presentation for IITB Showcase (Oct 29),Done Enough,initiative:micro-acquisitions,"RachelMuston, philipe-girard",initiative:micro-acquisitions,Micro-acquisition pilot: Fall launch
"Add governance modernization framework reference ",Done Enough,initiative:governance-study,gcharest,initiative:governance-study,Governance Study 1 - Research Phase
JC OSS - August Session Prep,Done Enough,"Open Source, Joint Councils",gcharest,,Z [Pending[ - Ongoing advice and unplanned work
Create and Consult CS-02 SOMC,Done Enough,initiative:hr-process,philipe-girard,initiative:hr-process,IM/IT Strategy and Planning HR Process
Review CS-02 Process requirements,Done Enough,initiative:hr-process,philipe-girard,initiative:hr-process,IM/IT Strategy and Planning HR Process
Present to EPMO our perspective on Product Mgt,Done Enough,initiative:product,remyb2canada,initiative:product,Product Mgt - Produce Business Case
JC OSS - Meet ICCS regarding OSS governance models,Done Enough,"Open Source, Joint Councils",gcharest,,Z [Pending[ - Ongoing advice and unplanned work
Blog post - micro-acquisition-pilot-update2.md,Done Enough,"Blog, initiative:micro-acquisitions",RachelMuston,initiative:micro-acquisitions,Micro-acquisitions pilot: 3 - Communications
Review Open First Strategy,Done Enough,strategies,gabrielcossette,,Z [Pending] Open First Strategy
"Provide EPMO on suggested metrics for identifying ""product status""",Done Enough,initiative:product,remyb2canada,initiative:product,Product Mgt - Create Branch Inititaive
"adjustments to adopt, build, buy outstanding feedback",Done Enough,website,,,Team's own Continuous Improvement and Administration
TSDM fr,Done Enough,website,ElminaIusifova,,
improved pandoc instructions,Done Enough,,RachelMuston,,Team's own Continuous Improvement and Administration
French version of the TSDM supporting document - areas of concern/outstanding feedback,Done Enough,,RachelMuston,,Team's own Continuous Improvement and Administration
MA - Review of the translated screens for how to get a GitHub account,Done Enough,initiative:micro-acquisitions,"gabrielcossette, RachelMuston",initiative:micro-acquisitions,Micro-acquisitions pilot: Operations and Continuous Improvement
MA - Review the french survey to suppliers text,Done Enough,initiative:micro-acquisitions,"gabrielcossette, RachelMuston, philipe-girard",initiative:micro-acquisitions,Micro-acquisitions pilot: Operations and Continuous Improvement
MA - Review of updated and simplified MA process documents,Done Enough,initiative:micro-acquisitions,RachelMuston,initiative:micro-acquisitions,Micro-acquisitions pilot: Operations and Continuous Improvement
MA - Accessibility review - round 2,Done Enough,initiative:micro-acquisitions,RachelMuston,initiative:micro-acquisitions,Micro-acquisitions pilot: Operations and Continuous Improvement
MA - add link to mailing list form to the MA website,Done Enough,initiative:micro-acquisitions,LeighGardner,initiative:micro-acquisitions,Micro-acquisitions pilot: 3 - Communications
MA - get text on the Student employment page about the MA pilot,Done Enough,initiative:micro-acquisitions,LeighGardner,initiative:micro-acquisitions,Micro-acquisitions pilot: 3 - Communications
MA - update those with admin rights on the MA repo,Done Enough,initiative:micro-acquisitions,RachelMuston,initiative:micro-acquisitions,Micro-acquisitions pilot: Operations and Continuous Improvement
MA - Auto-response messages from our generic mailbox to Notify is a problem,Done Enough,initiative:micro-acquisitions,RachelMuston,initiative:micro-acquisitions,Micro-acquisitions pilot: Operations and Continuous Improvement
Reach out to JobBank (SEB and IITB),Done Enough,initiative:product,remyb2canada,initiative:product,Product Mgt - Do Peer Reviews
Explore APM+ for potential new M.A. opportunity,Done Enough,initiative:micro-acquisitions,remyb2canada,initiative:micro-acquisitions,Micro-acquisitions pilot: Operations and Continuous Improvement
Contributions to existing OSS repo,Done Enough,,"gcharest, smellems, RachelMuston",,Micro-acquisitions pilot: Operations and Continuous Improvement
Follow up with interviewees,Done Enough,initiative:iitb-diagnostic,LeighGardner,initiative:iitb-diagnostic,IITB Diagnostic Study
Bug fix in fr About us page,Done Enough,,RachelMuston,,Team's own Continuous Improvement and Administration
Connect with someone responsible for a Program's Architecture,Done Enough,initiative:product,remyb2canada,initiative:product,Product Mgt - Do Research
Find who is ESDC's official responsible for service,Done Enough,initiative:product,remyb2canada,initiative:product,Product Mgt - Do Research
Publish product management strategy on the site,Done Enough,initiative:product,remyb2canada,initiative:product,Product Mgt - Produce Business Case
Contact MyESDC app,Done Enough,initiative:product,remyb2canada,initiative:product,Product Mgt - Scan current state
Product mgt defs,Done Enough,initiative:product,,initiative:product,Product Mgt - Do Research
MA - prepare deck for exec directors meeting,Done Enough,initiative:micro-acquisitions,RachelMuston,initiative:micro-acquisitions,Micro-acquisitions pilot: 3 - Communications
Present to Executive Director Committee,Done Enough,initiative:product,remyb2canada,initiative:product,Product Mgt - Create Branch Inititaive
Retain HR Logistics Services from FPS,Done Enough,initiative:hr-process,philipe-girard,initiative:hr-process,IM/IT Strategy and Planning HR Process